<?xml version="1.0" encoding="UTF-8"?>
<!-- Manually created Layouts for LexSense. -->
<LayoutInventory xmlns:xsi="http://www.w3.org/2001/XMLSchema-instance"
  xsi:noNamespaceSchemaLocation='ViewsLayout.xsd'>
  <layout class="LexSense" type="detail" name="Normal">
	<part ref="HeavySummary" param="Summary" collapsedLayout="SummaryCollapsed" expansion="expanded" menu="mnuDataTree-Sense" hotlinks="mnuDataTree-Sense-Hotlinks" notifyVirtual="LexSenseOutline">
		<indent>
			<part ref="GlossAllA"/>
			<part ref="DefinitionAllA"/>
			<part ref="MsaCombo"/>
			<part ref="ComplexFormEntries" visibility="ifdata"/>
			<part ref="VisibleComplexFormEntries" visibility="ifdata"/>
			<part ref="Subentries" visibility="ifdata"/>
			<part ref="VariantForms" visibility="ifdata"/>
			<part ref="Examples" param="Normal"/>
			<part ref="ScientificName" label="Scientific Name"   visibility="ifdata" />
			<part ref="AnthroNoteAllA" label="Anthropology Note"   visibility="ifdata" />
			<part ref="BibliographyAllA" label="Bibliography"   visibility="ifdata" />
			<part ref="DiscourseNoteAllA" label="Discourse Note"   visibility="ifdata" />
			<part ref="EncyclopedicInfoAllA" label="Encyclopedic Info"   visibility="ifdata" />
			<part ref="GeneralNoteAllA" label="General Note"   visibility="ifdata" />
			<part ref="GrammarNoteAllA" label="Grammar Note"   visibility="ifdata" />
			<part ref="PhonologyNoteAllA" label="Phonology Note"   visibility="ifdata" />
			<part ref="RestrictionsAllA"   visibility="ifdata" />
			<part ref="SemanticsNoteAllA" label="Semantics Note"   visibility="ifdata" />
			<part ref="SocioLinguisticsNoteAllA" label="Sociolinguistics Note"   visibility="ifdata" />
			<part ref="Source"   visibility="ifdata" />
			<part ref="UsageTypes"   visibility="ifdata" />
			<part ref="ReversalEntries"   visibility="ifdata" />
			<part ref="SenseType"   visibility="ifdata" />
			<part ref="DomainTypes"   visibility="ifdata" />
			<part ref="PublishIn"   visibility="ifdata" />
			<!-- part ref="ThesaurusItems" label="Thesaurus Items"/ -->

			<part ref="SemanticDomains"   visibility="always" />
			<part ref="AnthroCodes"   visibility="ifdata" />
	  <!-- part ref="Appendixes"/ -->
			<part ref="Status"   visibility="ifdata" />
			<part ref="CurrentLexReferences"/>
			<part ref="ImportResidue" label="Import Residue" visibility="ifdata"/>
			<part ref="Pictures" param="Normal"/>
	  <!-- Special part to indicate where custom fields should be inserted at.  Handled in Common.Framework.DetailControls.DataTree -->
			<part customFields="here" />
			<part ref="Senses" label="SubSenses" param="Normal" menu="mnuDataTree-Subsenses"/>
	</indent>
	</part>
  </layout>

	<layout class="LexExampleSentence" type="detail" name="Normal">
		<part ref="ExampleAllV" label="Example" expansion="expanded">
			<indent>
				<part ref="TranslationsAllA" expansion="expanded" param="TranslationAndType"/>
				<part ref="Reference"/>
				<part customFields="here" />
			</indent>
		</part>
		<part ref="PublishIn"   visibility="ifdata" />
	</layout>

	<layout class="CmPicture" type="detail" name="Normal">
		<part ref="Picture" label="Picture"/>
		<part ref="Thumbnail" label="Thumbnail" visibility="never"/>
		<part ref="CaptionA" label="Caption"/>
		<part ref="FileName" label="File"/>
	</layout>
	<layout class="CmFile" type="detail" name="Normal">
		<part ref="FileName" label="File"/>
	</layout>

	<!-- This layout is used by the Find Example Sentence dialog. -->
	<layout class="LexExampleSentence" type="jtview" name="publicationNew">
		<part ref="ExamplePub" label="Example" before="" after="" visibility="ifdata" ws="all vernacular" sep=" " showLabels="false" style="Dictionary-Vernacular"/>
		<part ref="TranslationsPub" label="Translations" before="" after="" visibility="ifdata" sep=""/>
	</layout>

	<layout class="CmTranslation" type="detail" name="TranslationAndType">
		<part ref="TranslationAllA">
			<indent>
				<part ref="Type"/>
			</indent>
		</part>
	</layout>

	<layout class="LexReference" type="detail" name="ShowSingleReference">
		<part ref="ShowSingleReference"/>
	</layout>

	 <layout class="LexSense" type="jtview" name="CrossRefPub">
		<part ref="OwnerOutlinePub" label="Referenced Sense Headword" before="" after=" " visibility="ifdata" ws="vernacular" sep=" " showLabels="false" style="Dictionary-CrossReferences"/>
		<part ref="GlossPub" label="Gloss" before="" after=" " visibility="never" ws="all analysis" sep=" " showLabels="false"/>
	 </layout>

	<layout class="LexSense" type="jtview" name="classifiedDict">
		<sublayout name="classifiedDictI1" group="para" style="Classified-Item"/>
	</layout>
	<layout class="LexSense" type="jtview" name="classifiedDictI1">
		<part ref="OwnerOutlinePub" label="Referenced Sense Headword" before="" after=" " visibility="ifdata" ws="vernacular" sep=" " showLabels="false" style="Classified-Headword"/>
		<part ref="MorphoSyntaxAnalysisPub" label="Category" before="" after=" " visibility="ifdata" style="Classified-POS"/>
		<!-- Show the definition if it exists, otherwise show the gloss. -->
		<part ref="SmartDefinitionPub" label="Definition" before="" after=" " visibility="ifdata" ws="analysis" sep=" " showLabels="false" style="Classified-Defn"/>
	</layout>

	<!-- STUFF ADDED FOR NEW CONFIGURATION WORK -->

	<layout class="LexSense" type="jtview" name="publishStem_AsPara">
		<sublayout name="publishStem"/>
	</layout>
	<layout class="LexSense" type="jtview" name="publishStem">
		<part ref="MorphoSyntaxAnalysisConfig" label="Grammatical Info." before="" after=" " sep="" visibility="ifdata" style="Dictionary-Contrasting" singlegraminfofirst="yes" param="publishStem" css="grammatical-info"/>
		<part ref="SenseTypeConfig" label="Sense Type" before="(" after=") " visibility="ifdata" style="Dictionary-Contrasting" param="publishStemSenseType" css="sense-type"/>
		<part ref="SmartDefinitionPub" label="Definition (or Gloss)" before="" after=" " visibility="ifdata" ws="analysis" wsType="analysis" sep=" " showLabels="false" css="definition"/>
		<part ref="DefinitionPub" label="Definition" before="" after=" " visibility="never" ws="all analysis" wsType="analysis" sep=" " showLabels="false"/>
		<part ref="GlossPub" label="Gloss" before="" after=" " visibility="never" ws="all analysis" wsType="analysis" sep=" " showLabels="false"/>
		<part ref="ExamplesConfig" label="Examples" before="" after=" " sep="  " visibility="ifdata" param="publishStem" css="examples"/>
		<part ref="EncyclopedicInfoPub" label="Encyclopedic Info." before="[" after="] " visibility="ifdata" ws="all analysis" wsType="analysis" sep=" " css="encyclopedic-info"/>
		<part ref="RestrictionsPub" label="Restrictions" before="Restrictions: " after="] " visibility="ifdata" ws="all analysis" wsType="analysis" sep=" " css="restrictions"/>
		<part ref="LexReferencesConfig" label="Lexical Relations" before="" after=". " sep="; " visibility="ifdata" param="publishStemSenseRef" css="relations" lexreltype="sense"/>
		<part ref="VariantFormsConfig" label="Variants of Sense" before="(" after=") " sep="; " visibility="ifdata" param="publishStemSenseVariantRef" css="sense-variantrefs"/>
		<part ref="AnthroNotePub" label="Anthropology Note" before="" after=" " visibility="never" ws="all analysis" wsType="analysis" sep=" " showLabels="false"/>
		<part ref="BibliographyPub" label="Bibliography" before="" after=" " visibility="never" ws="all analysis" wsType="analysis" sep=" " showLabels="false"/>
		<part ref="DiscourseNotePub" label="Discourse Note" before="" after=" " visibility="never" ws="all analysis" wsType="analysis" sep=" " showLabels="false"/>
		<part ref="PhonologyNotePub" label="Phonology Note" before="" after=" " visibility="never" ws="all analysis" wsType="analysis" sep=" " showLabels="false"/>
		<part ref="GrammarNotePub" label="Grammar Note" before="" after=" " visibility="never" ws="all analysis" wsType="analysis" sep=" " showLabels="false"/>
		<part ref="SemanticsNotePub" label="Semantics Note" before="" after=" " visibility="never" ws="all analysis" wsType="analysis" sep=" " showLabels="false"/>
		<part ref="SocioLinguisticsNotePub" label="Sociolinguistics Note" before="" after=" " visibility="never" ws="all analysis" wsType="analysis" sep=" " showLabels="false"/>
		<part ref="GeneralNotePub" label="General Note" before="" after=" " visibility="never" ws="all analysis" wsType="analysis" sep=" " showLabels="false"/>
		<part ref="ScientificName" label="Scientific Name" before="" after=" " visibility="ifdata" css="scientific-name"/>
		<part ref="Source" label="Source" before="" after=" " visibility="never"/>
		<part ref="SemanticDomainsConfig" label="Semantic Domains" before="(sem. domains: " after=".) " sep=", " visibility="ifdata" param="publishStemSemDom" css="semantic-domains"/>
		<part ref="AnthroCodesConfig" label="Anthropology Categories" before="anthro. codes " after=" " visibility="never" sep=", " param="publishStemAnthro"/>
		<part ref="DomainTypesConfig" label="Academic Domains" before="ac. domains: " after=" " visibility="ifdata" sep=", " param="publishStemDomainType" css="domain-types"/>
		<part ref="UsageTypesConfig" label="Usages" before="{" after="} " visibility="ifdata" sep=", " param="publishStemUsageType" css="usage-types"/>
		<part ref="StatusConfig" label="Status" before=" status " after=" " visibility="never" param="publishStemStatus" css="status"/>
		<generate class="LexSense" fieldType="mlstring" restrictions="customOnly">
			<part ref="$child" label="$label" before="" after=" " visibility="never" ws="$wsName" sep=" " showLabels="false">
				<configureMlString field="$fieldName" />
			</part>
		</generate>
		<generate class="LexSense" fieldType="simplestring" restrictions="customOnly">
			<part ref="$child" label="$label" before="" after=" " visibility="never">
				<string field="$fieldName" />
			</part>
		</generate>
		<generate class="LexSense" fieldType="refatom" restrictions="customOnly">